{
  "id": "S-2",
  "sequent": {
    "ante": [],
    "succ": [
      {
        "id": "F-2s",
        "formula": {
          "name": "imply",
          "id": "F-2s0",
          "children": [
            { "name": "lt", "id": "F-2s1", "children": [ {"name": "z", "id": "F-2s2"}, {"name": "1", "id": "F-2s3"} ] },
            {
              "name": "and", "id": "F-2s4",
              "children": [
                {
                  "name": "and", "id": "F-2s5",
                  "children": [
                    { "name": "lt", "id": "F-2s6", "children": [ {"name": "x", "id": "F-2s7"}, {"name": "5", "id": "F-2s8"} ] },
                    { "name": "true", "id": "F-2s9" }
                  ]
                },
                { "name": "gt", "id": "F-2s10", "children": [ {"name": "2", "id": "F-2s11"}, {"name": "y", "id": "F-2s12"} ] }
              ]
            }
          ]
        }
      }
    ]
  },
  "children": [ "S-1" ],
  "rule": { "id": "R0", "name": "skip" },
  "parent": "S-2"
}