{
  "id": "S4",
  "sequent": {
    "ante": [ {"id": "F4a", "formula": { "name": "lt", "id": "F4a0", "children": [ {"name": "z", "id": "F4a1"}, {"name": "1", "id": "F4a2"} ] }} ],
    "succ": [
      {
        "id": "F4s",
        "formula": {
          "name": "and",
          "id": "F4s0",
          "children": [
            { "name": "lt", "id": "F4s1", "children": [ {"name": "x", "id": "F4s2"}, {"name": "5", "id": "F4s3"} ] },
            { "name": "true", "id": "F4s4" }
          ]
        }
      }
    ]
  },
  "children": ["S5"],
  "rule": { "id": "R0", "name": "skip" },
  "parent": "S2"
}